{"artifact_id":"dfv0_issue69_phase_d_scale_v1_20260713","attestation":{"approved_for_publication":true,"archives_freshly_restored_and_every_descriptor_member_reverified":true,"every_record_join_and_predicate_reverified":true,"exact_selection_independently_recomputed":true,"source_membership_references_reverified":true},"authority_status":"approved_for_publication","bindings":{"archive_verification_manifest_sha256":"17ae3e84611a5da3c701fc3b98fcaadc7852b827cb1abac444686ca4572170e5","candidate_selection_sha256":"d6aec52d39d83a3fda645d56f101890ad176b3e1851851b2787db98d2645f78d","counts":{"aerial":20,"control":10,"ground":30,"selected":60},"source_archives":{"canonical_image_recovery_v1":{"bundle_sha256":"dab076491097ac1fa4c9b1295317d067e29442b12831ede65731941894a859a6","byte_count":306337452,"descriptor_sha256":"bf76a4d59b0f5dfd6b59d61539b2ada017f89d00cb74f76f4b8a0688056e3b37","member_count":267,"tree_sha256":"38927e0e1fc4c205b2e7ae12f0522f64bcaec21dad31c27e045536515eebb47b"},"gold_label_batch_002":{"bundle_sha256":"11c4577c5fa2b0393d2c83a9c9a75effcf7c97252febc646fa8ceca4e6789fcd","byte_count":298219538,"descriptor_sha256":"1b51abf1fd9c385f71447c8bead85dfb61268068e4f30b6b0c219b90fd032098","member_count":1548,"tree_sha256":"bbe746e0564012ea61e872219af7dd7140bd320d49a8c6521589bc549a79cf57"},"real_pilot_independent_visual_review_v1":{"bundle_sha256":null,"byte_count":23438,"descriptor_sha256":"e614092da109c9fc90802dafae1b62741669aa748323bb43b98c2ad6235513e7","member_count":3,"tree_sha256":"724990f5c92fa2c656a1a609a4381788b679a11a8980ffe12e2b48560b832214"},"real_pilot_intelligence_v1":{"bundle_sha256":null,"byte_count":1944373,"descriptor_sha256":"178ceef735838c85c800c5c57f0b69808c4ba23157bbad00187a02d93f7ab137","member_count":45,"tree_sha256":"c488c629c718ec0e559f6d15caac02dfd74096ef56d32bf474f6887c0aa021a7"},"real_pilot_visual_promotion_v1":{"bundle_sha256":null,"byte_count":370674,"descriptor_sha256":"8fe075ab8770891662b3b78045ea77d179455af893fdef5f68a28b4e6f2f075a","member_count":4,"tree_sha256":"366bc2e66b9ca863c117a249197cccef8627b04017da065f21960f34f84c2c87"}},"source_membership_reference_count":1210,"source_membership_references_sha256":"b02d19195dfe632131f9d679587cd7e6251687d02f30e5d872cf33527a97f1ba"},"notes":"Fresh independent Sol High r4 review authenticated six predecessor Git blobs and all five source artifacts (1,867 members; 606,895,475 bytes), reverified all 1,210 source-reference occurrences without lossy deduplication, independently recomputed the ordered 60-record selection and all joins/predicates, checked all 12 pilots and decoded 234 selected pixel views, and passed candidate/fresh-source verification, the 53-case self-test, integration replay, scripts typecheck, receipt-path tests, and diff/mutation checks. Authority remains visual/provenance selection only: new external claims, verified dossiers, and accepted tasks are zero, and exact aerial measurements remain null.","reviewer":{"model":"gpt-5.6-sol","reasoning_effort":"high","reviewed_at":"2026-07-14T01:38:49.081Z","reviewer_id":"sol-high:019f5e3a-f6a8-7513-aa24-98707ba16a10","session_id":"019f5e3a-f6a8-7513-aa24-98707ba16a10"},"schema_version":"issue69_phase_d_reviewer_selection_receipt_v1.0.0"}
